Centre Socioculturel Accoord - Perray-Haluchère;L’Accoord a pour objectif de développer l’action éducative, sociale et culturelle pendant le temps libre à Nantes. L’association propose une offre de services autour de l'animation sociale, le développement culturel et les loisirs socio-éducatifs. Des espaces multimédias sont ouverts pour découvrir, utiliser et être aidé dans la pratique du multimédia. Des formations et des ateliers y sont également proposés régulièrement.;- Accéder à Internet- Pratiquer une activité ludique et éducative;- Assistance et conseil sur place- Ateliers  : la production de vidéos, de jeux vidéo, réparation bureautique- Cours selon la demande (montage photo, messagerie, Internet, …)- Fab Lab (atelier de création) animé par Efferv&sciences : Imprimante 3D, programmation, borne Arcade;sur inscription;;pour tous;;payant (adhésion annuelle : de 0 à 15€);ordinateurs équipés d’accès Internet et de logiciels bureautiques, imprimante, scanner, Wifi;;;14h00-17h30;;16h00-18h00;14h00-17h00;;;1 rue Jules Grandjouan;44300;Nantes;02 40 49 74 69;;perray@accoord.fr;http://cscperray.blogspot.fr/;L11 - L12 (arrêt Perray);;47.247549,-1.512745
Centre Socioculturel Accoord - Port Boyer;L’Accoord a pour objectif de développer l’action éducative, sociale et culturelle pendant le temps libre à Nantes. L’association propose une offre de services autour de l'animation sociale, le développement culturel et les loisirs socio-éducatifs. Des espaces multimédias sont ouverts pour découvrir, utiliser et être aidé dans la pratique du multimédia. Des formations et des ateliers y sont également proposés régulièrement.;- Être initié aux outils numériques;- Ateliers  organisés par Alis44 :prise en main du matériel, navigation web, création-gestion de boite mail, traitement de texte, information autour des logiciels libres- Cours d’informatique organisés par l’Amicale laïque de Port-Boyer;sur inscription;;public;pour les adultes et particulièrement, pour les personnes en situation de précarité et pour les habitants du quartier;payant (adhésion annuelle : de 0 à 15€);ordinateurs équipés d’accès Internet et de logiciels bureautiques,;;;;17h30-19h30;;;;;7 rue de Pornichet;44300;Nantes;02 40 49 21 81;;port-boyer@accoord.fr;https://www.accoord.fr/http://port-boyer.blogspot.fr/;L23 (arrêt Pouliguen);;47.240123,-1.542848
Centre Socioculturel Accoord - Île De Nantes;L’Accoord a pour objectif de développer l’action éducative, sociale et culturelle pendant le temps libre à Nantes. L’association propose une offre de services autour de l'animation sociale, le développement culturel et les loisirs socio-éducatifs. Des espaces multimédias sont ouverts pour découvrir, utiliser et être aidé dans la pratique du multimédia. Sur le numérique, le centre socioculturel Île de Nantes axe son offre sur la programmation, les activités éducatives et ludiques, l’impression 3D et la robotique.;- Accéder à Internet- Être initié aux outils numériques- Être sensibilisé aux risques d'Internet- Être accompagné dans son projet personnel ou professionnel- Pratiquer une activité ludique et éducative;- Assistance et conseil sur place- Ateliers : Internet, la bureautique, le montage vidéo, la photo numérique, l’initiation de Windows 10, l’utilisation de tablettes et smartphones, la création de blog, les réseaux sociaux, la protection de son ordinateur, la gestion du courrier électronique, les outils Google, la maintenance de l’ordinateur…;sur inscription;;pour tous;;payant (adhésion annuelle : de 0 à 15€);ordinateurs équipés d’accès Internet et de logiciels bureautiques, imprimantes, scanner, Wifi;14h00-18h00;9h15-11h15 / 14h00-18h00 / 19h00-21h00;10h00-12h00 / 14h00-18h00;9h00-13h00 / 14h00-17h30;9h15-12h15 / 14h00-16h00;;;;2 rue Conan Mériadec;44200;Nantes;02 44 76 32 24;;ile@accoord.fr;https://www.accoord.fr/https://www.facebook.com/MQ-de-l%C3%8Ele-300588676773498/;Tramway L2 - L3 (arrêt Vincent Gâche) / Chronobus C5 (arrêt Nizan);Label  NetPublic;47.206454,-1.55057
Médiathèque Floresca Guépin;Ouvertes à tous, les médiathèques municipales sont présentes dans les différents quartiers de la Ville de Nantes. Elles proposent un large catalogue de documents (livres, CD, DVD, BD, …) accessibles en ligne ainsi que de ordinateurs pour la consultation d'Internet et/ou des logiciels de bureautique. Certaines médiathèques proposent également des ateliers d’initiation au numérique et la lecture numérique pour les malvoyants.;- Accéder à Internet - Être initié aux outils numériques;- Assistance et conseil sur place- Ateliers : créer et gérer son compte Facebook, Victor Reader et Vocal Presse (lecture numérique pour malvoyants);libre;;pour tous;;gratuit;ordinateurs équipés d’accès Internet et de logiciels bureautiques (certains ordinateurs sont adaptés aux malvoyants), photocopieur, imprimante, Wifi;;13h30-19h00;10h30-18h00;13h30-18h00;13h30-18h00;10h00-17h00;;;15 rue de la Haluchère;44300;Nantes;02 40 93 41 60;;bm-est@mairie-nantes.fr;https://bm.nantes.fr/home.html;Tramway L1 (arrêt Souillarderie) - Chronobus C7 (arrêt Cousteau);;47.24076,-1.512784
Trempolino;Trempolino est une association, créée en 1990, dans le but d’accompagner, de développer et de promouvoir les musiques actuelles. Aujourd’hui Trempolino élargit son concept et devient un lieu culturel dont la vocation est artistique et aussi éducative, sociale et économique. Trempolino propose des programmes et des services pour tous les publics, les musiciens et les entrepreneurs. A ce titre, Trempolino contribue au développement de la filière musicale régionale et à l’émergence de nouvelles pratiques artistiques.;- Accéder à Internet- Pratiquer une activité ludique et éducative;- Assistance et conseil sur place- Stages : Musique assistée par ordinateur;libre;;pour tous;;accès Internet gratuit - stage payant (de 31 à 90€);ordinateurs équipés d’accès Internet et de logiciels bureautiques, Wifi;9h00-20h00;9h00-20h00;9h00-20h00;9h00-20h00;9h00-20h00;;;;6 boulevard Léon Bureau;44200;Nantes;02 40 46 66 33;;info@trempo.com;http://www.trempo.com/;Tramway L1 (arrêt Chantiers Navals) / Chronobus C5 (arrêt Prairie au Duc);;47.20526,-1.563189
La Bagagerie - Saint Jacques (Association Saint Benoît Labre);L’association Saint Benoît Labre lutte contre l’exclusion des personnes en difficultés sociales et professionnelles et vient en aide aux personnes et familles en précarité. Dans ce cadre, l’association met à disposition des usagers de l’association des espaces informatiques dans ses centres d’hébergement. Ces lieux d’activité informatique permettent de s’initier à l’informatique, d’utiliser Internet, de créer un CV, d’échanger avec ses proches par mail, de se détendre, de se cultiver et de se former à la bureautique.;- Accéder à Internet- Être initié aux outils informatiques- Être accompagné dans mon projet personnel ou professionnel;;Adhérents et résidents à la Bagagerie;;personnes en situation de précarité;;gratuit;ordinateurs équipés d’accès Internet et de logiciels bureautiques, Wifi;24h/24h;24h/24h;24h/24h;24h/24h;24h/24h;;;;7 rue Frère Louis;44200;Nantes;;;;http://asbl44.com/;Tramway L2 L3 (arrêt Pirmil) / L42 (arrêt Saint Jacques);;47.195534,-1.538346
UFUT44;Une Famille Un Toit 44 a pour objet principal de participer à la lutte contre l’exclusion, avec le concours des divers acteurs concernés, par une action sociale et humanitaire favorisant l’insertion par le logement, l’emploi et l’accès à la citoyenneté des personnes et des familles en difficultés. Depuis 2015, l’association développe le projet J’apprends le français et organise des stages de français visant l’accès à l’emploi et  l’accès à l’outil numérique pour une meilleure insertion en France des personnes ne parlant pas le français.;- Accéder à Internet- Être accompagné dans ses démarches administratives- Être initié aux outils informatiques- Être accompagné dans mon projet professionnel- Être sensibilisé aux risques d’Internet,- Pratiquer une activité ludique et éducative.;permanence connectée et stages de français numérique (découverte de l’ordinateur, création et gestion boîte mail, recherche emploi et logement sur Internet, création de document (CV), outils de rédaction et de traduction, utilisation d’une clé USB);sur inscription;;personnes en situation de précarité ne parlant pas le français;;gratuit;ordinateurs portables, imprimante, scanner, vidéoprojecteur, enceintes, clés USB;13h30-17h00;9h00-12h30 / 13h30-17h00;;;;;;;Maison de quartier de la Bottière, 147 route de Sainte-Luce,;44300;Nantes;09 72 31 44 13;;contact@unefamilleuntoit44.org;http://www.unefamilleuntoit44.org;Tramway 1 arrêt Souillarderie, Bus ligne 11 arrêt Bois Robillard;;47.235883,-1.518898
Fragil;Média culturel et social produit dans la métropole nantaise dans le style Do It Yourself à l’origine , Fragil accompagne également aujourd’hui des projets d’éducation aux médias et aux pratiques numériques à dimension régionale.Débutant ou aguerri, étudiant ou actif, Fragil propose un espace convivial et ouvert à tous, afin de développer des projets grâce à un collectif de bénévoles et de professionnels.;- Être initié aux outils numériques- Être accompagné dans son projet personnel ou professionnel- Pratiquer une activité ludique et éducative- Être sensibilisé aux risques d'Internet;- Assistance et conseil sur place- atelier : la maîtrise de son empreinte numérique, l’utilisation des réseaux sociaux , la recherche d'emploi sur le web , le décryptage de la culture numérique, la photo, la réalisation de capsules sonores ou vidéo, l’utilisation de son smartphone en reportage;sur inscription;;pour tous;à partir de 18 ans;payant (adhésion annuelle : de 31 à 90€ - tarif selon statut);ordinateurs équipés d’accès Internet, de logiciels bureautiques et de logiciels de graphisme, matériel de reportage (appareil photo, enregistreur, …);;;;;;;;Horaires variables en fonction des ateliers;La Fabrique Dervallières - 19 rue Jean Marc Nattier;44100;Nantes;02 40 86 37 03;;educationauxmedias@fragil.org;http://www.fragil.org/;Chronobus C3 (arrêt Delacroix);;47.225014,-1.591085
CPAM Beaulieu;La Caisse Primaire d’Assurance Maladie a aménagé des espaces libre-service dans ses points d'accueil pour permettre d'effectuer soi-même ses démarches les plus courantes. Animés par les agents d'accueil, ces espaces offrent la possibilité de mettre à jour sa carte Vitale, commander une Carte Européenne d'Assurance Maladie, imprimer ses attestations de droits ou de paiement d'indemnités journalières en utilisant les outils en libre-accès (borne multi-services ou ordinateur avec accès internet) reliés à une imprimante. Pour les dossiers complexes nécessitant une étude approfondie ainsi que pour les dossiers CMU ressources, un rendez-vous est proposé.;- Accéder à Internet- Être accompagné dans mes démarches administratives;Assistance et conseil sur place;libre;;pour tous;;gratuit;"Borne multi-services située à l'extérieur accessible 24h/24 et 7j/7 ; Ordinateur en libre-service avec accès Internet aux sites ameli.fr, caf.fr, pole-emploi.fr et carsat.fr, imprimante";8h30-12h15 / 13h30-17h00;8h30-12h15 / 13h30-17h00;8h30-12h15 / 13h30-17h00;8h30-12h15 / 13h30-17h00;8h30-12h15 / 13h30-17h00;;;;9 rue Gaëtan Rondeau;44200;Nantes;3646.0;;;http://www.ameli.fr/;Chronobus C5 (arrêt Conservatoire);;47.206557,-1.534359
Marie et Alphonse;L’atelier marie et alphonse, c’est une équipe de professionnels de l'image et du son qui a uni ses compétences au service de l’expérimentation des formes et des tendances. Le collectif a à coeur de favoriser le numérique dans ses projets, initier et encourager le jeune public dans ses pratiques et faciliter l'expression participative locale par le biais de le vidéo et du web.;- Pratiquer une activité ludique et éducative;Ateliers : vidéo, montage;sur inscription;;pour les jeunes de 10 à 14 ans;;payant (adhésion annuelle : de 31 à 90€) + prix des atelier;ordinateurs, caméra, stations de montage;;;;;;;;Horaires variables en fonction des atelier;Pole associatif des Hauts-Pavés - 42 Rue des Hauts Pavés;44000;Nantes;06 07 96 54 50;;info@letoilerie.comVirginie.lefebvre@marie-et-alphonse.com.;http://www.letoilerie.com/http://marie-et-alphonse.com/;L3 (arrêt Poitou);;47.224319,-1.564698
ID Numéric;Dans un esprit de partage et grâce à l'utilisation de méthodes pédagogiques actives, l'association ID Numéric favorise l'autonomie numérique dans tous les champs de la vie quotidienne. Le collectif propose des interventions (ateliers et formations) individuelles ou en petits groupes, en réponse aux attentes des habitants, des associations et de toutes personnes en besoin d’accompagnement.;- Accéder à l'Internet- Être initié aux outils numériques- Être accompagné dans mes démarches administratives- Être accompagné dans son projet personnel ou professionnel- Être sensibilisé aux risques d'Internet- Pratiquer une activité ludique et éducative;- Assistance et conseil sur place- Ateliers : alphabétisation numérique, être initié à l'ordinateur et aux outils bureautique, apprendre à taper du texte, écrire un courrier. Découvrir et connaître les bases du tableur. Accès  « internet  accompagné », aide et soutien dans les recherches et collectes d’informations ( vie quotidienne, accès au droit, accès à l'emploi, formation, ldémarches administratives, accès aux ressources locales …). Mails, création gestion et  aide à la rédaction de courrier types mails. Réseaux sociaux (prévention, accompagnement). Expéditions numériques », expérimenter la photo numérique sur différents supports (tablette, téléphone, appareil photo numérique) en partant à la découverte de Nantes et ses environs.- Ateliers périscolaires :  pratiques éducatives, ludiques et créatives des outils et usages numériques;libre, information  tous les 1er lundis du mois  (hors vacances scolaires) et les jeudis matins de 10h à 12h ou par téléphone;;pour tous;grands débutants;Adhésion, cotisation annuelle : de 0 à 15€. Ateliers tarifs adaptés en fonction des revenus (demandeur d'emploi, faible revenu). Formations professionnelles (études des besoins, salariés associations, demandeurs d'emplois).;salle numérique équipée d'ordinateurs, logiciels libres bureautiques, accès Internet (connexion Wifi). Matériels en prêts;;;;;;;;Libre, information  tous les 1er lundis du mois  (hors vacances scolaires) et les jeudis matins de 10h à 12h ou par téléphone;Maison des habitants et du citoyen - 1 place des Lauriers;44100;Nantes;07 51 67 30 75;;idnumeric.asso@gmail,com;http://www.idnumeric.fr/;Tramway L1 (arrêt Lauriers);;47.204709,-1.605251
Bibliothèque de la Manufacture;Ouvertes à tous, les bibliothèques municipales sont présentes dans les différents quartiers de la Ville de Nantes. Elles proposent un large catalogue de documents accessibles en ligne ainsi que des ordinateurs pour la consultation d'Internet dont certains disposent également de logiciels de bureautique.;Accéder à Internet;Assistance et conseil sur place;libre;;pour tous;;gratuit;ordinateurs équipés d’accès Internet et de logiciels bureautiques, photocopieur, imprimante, Wifi;;13h30-18h00;10h30-12h00 / 13h30-18h00;13h30-18h00;13h30-19h00;10h00-12h00 / 13h30-17h00;;;6 cour Jules Durand;44000;Nantes;02 40 41 95 65;;bm-est@mairie-nantes.fr;https://bm.nantes.fr;Tramway L1 et L12 (arrêt Manufacture);;47.219841,-1.536477
Plateforme Intermédia;La Plateforme Intermédia est une proposition artistique et culturelle d’APO33 à la Fabrique île de Nantes. L’objectif de ce lieu est de mettre en avant les modes de pratique actuelle, contemporaine croisant art, musique, technologie, philosophie, social et les liens qui existent entre ces disciplines. Avec la plateforme intermédia, APO33 créé un espace qui permet de rendre visible les genres de la création “intermédia”, d’inviter le grand public à découvrir des projets qui reflètent les innovations du quotidien et leurs importances dans la transformation de notre société.;Pratiquer une activité ludique et éducative;- Assistance et conseil sur place- Ateliers : Musique électronique et création numérique sonore;sur inscription;;pour tous;;atelier payant (de 31 à 90€);systéme informatique pour la création numérique – Apo33, imprimante 3D, caméra, enregistreur sonore, système amplification, vidéoprojecteur, station montage électronique, Fablab, bricolage, arduino, raspberry pi, Wifi;;;;;;;;Horaires variables en fonction des atelier;4 boulevard Léon Bureau;44200;Nantes;02 51 89 47 16;;orga@apo33.org;http://apo33.org/index.php/fr/;Tramway L1 (arrêt Chantiers Navals);;47.206011,-1.563948
FAImaison;"FAImaison promeut le développement d'un internet respectueux des droits et libertés et est à ce titre fournisseur d'accès à Internet (FAI). Le respect des droits sur internet étant conditionné par de nombreuses caractéristiques techniques (réseau, matériel, logiciels), l'association encourage sa réappropriation citoyenne à travers : la défense de la neutralité du réseau, indispensable à la liberté d'expression et à la vie privée ; la décentralisation humaine et technique pour réduire la contrôlabilité et démocratiser le savoir et l'accès au réseau ; le placement de l'utilisateur comme administrateur éclairé du réseau ; la promotion du logiciel libre pour que l'utilisateur ne soit pas captif d'une technologie.";- Accéder à Internet- Être sensibilisé aux risques d'Internet;- Assistance et conseil sur place- Ateliers et temps d’échange : fabrication d'accès à Internet, neutralité du réseau, protection de la vie privée.;- libre;;pour tous;;gratuit;Wifi;;;;19h00-22h00;;;;;Local associatif autogéré B17 - 17 rue Paul Bellamy -;44000;Nantes;07 82 32 42 38;;contact@faimaison.net;https://www.faimaison.net/;Chronobus C1 (arrêt Bel Air);;47.221887,-1.556405
Centre Socioculturel Accoord - Malakoff Pré Gauchet;L’Accoord a pour objectif de développer l’action éducative, sociale et culturelle pendant le temps libre à Nantes. L’association propose une offre de services autour de l'animation sociale, le développement culturel et les loisirs socio-éducatifs. Des espaces multimédias sont ouverts pour découvrir, utiliser et être aidé dans la pratique du multimédia. Le centre socioculturel Accoord Malakoff Pré Gauchet propose également un accompagnement à l’appropriation des usages numériques pour des projets personnels et professionnels.;- Accéder à Internet- Être initié aux outils numériques- Être sensibilisé aux risques d'Internet- Être accompagné dans mes démarches administratives- Pratiquer une activité ludique et éducative;- Assistance et conseil sur place- Ateliers : la découverte informatique et multimédia, Internet, la bureautique, la vidéo, la photo, les  jeux en réseau, la vidéo conférence, l’accompagnement de projets (création blog) et le dépannage.;sur inscription;;pour tous;;payant (adhésion annuelle : de 0 à 15€);ordinateurs équipés d’accès Internet, de logiciels bureautiques, de logiciel de retouche d'images et de logiciels de jeux, imprimante;10h00-12h00 / 16h30-18h00;16h30-18h00;10h00-12h00 / 14h00-16h30;16h30-18h00;;;;;1 bis boulevard de Berlin;44000;Nantes;02 40 47 70 53;;cyberaccoordmalakoff@gmail.com;http://csc-malakoff.blogspot.fr/;Chronobus C3 – C5 (arrêt Haubans);Label  NetPublic;47.213809,-1.529764
Centre Communal d'Action Social (CCAS);Rendre le numérique accessible à tous, notamment aux personnes les plus fragiles, en situation de précarité sociale, constitue l’une des orientations du Centre communal d’action sociale (CCAS). Engagé dans l’accompagnement de celles et ceux qui ont besoin d'être guidés dans l’usage du numérique, il développe  des actions de médiation et des ateliers pour faciliter l’accès des Nantais fragilisés aux outils numériques.;- Accéder à Internet - Être initié aux outils informatiques- Être accompagné dans mes démarches administratives;- Assistance et conseil sur place (créer son compte de messagerie, e-demarches ...)- atelier hebdomadaire (mardi matin) animé par la fondation de l’entreprise Orange - Orange Solidarité : découverte de l’ordinateur, navigation Internet, messagerie, les bases du traitement de texte, accéder et sauvegarder ses documents- Animations (mardi après-midi de novembre à fin mai) par l’association Unis-Cité pour faire découvrir des sites utiles dans la vie quotidienne;libre;Présentation à l’accueil. Pour les ateliers : inscription à l’accueil.;pour tous;;gratuit;ordinateurs équipés d’accès Internet et de logiciels bureautiques, photocopieur, imprimante, scanner, Wifi;10h00-16h30;10h00-16h30;10h00-16h30;10h00-16h30;10h00-16h30;10h00-16h30;;;1 bis place Saint Similien;44000;Nantes;02 40 99 27 00;;;http://www.nantes.fr/ccas;Tramway L3 (arrêt Bretagne), Tramway L2 (arrêt 50 otages), Chronobus C2 et L12 (arrêt Cirque-Marais);;47.220014,-1.55843
Dclic;Géré par un collectif de 5 associations (L.I.R.E, CSF, ALD, Espaces Formation, les 2 Rives), le pôle informatique Dclic des Dervallières est le lieu labellisé Espace Régional Numérique, sur Nantes, pour découvrir les Technologies de l'Information et de la Communication et les rendre accessibles à tous.;- Accéder à Internet- Être initié aux outils numériques- Être sensibilisé aux risques d'Internet- Être accompagné dans mes démarches administratives- Pratiquer une activité ludique et éducative;- Assistance et conseil sur place- atelier : l’initiation à l'informatique, la création de support de communication, le montage vidéo, la musique assistée par ordinateur, la création de blogs ou de sites web.- atelier d’initiation individuel - Fab Lab (atelier de création);libre (sous condition d’adhésion);;pour tous;;payant (adhésion annuelle : de 31 à 90€ - tarif en fonction de l’âge);ordinateurs équipés d’accès Internet et de logiciels bureautiques, imprimantes, scanner, photocopieur, Wifi;;;16h00-18h00;;14h00-16h00;;;;Pôle associatif de la Palmeraie - 19 rue Auguste Renoir;44100;Nantes;02 40 43 79 47;;dclic.dervallieres@wanadoo.fr;;Chronobus C3 (arrêt Prière), C6 (arrêt St Laurent);Label  NetPublic;47.224053,-1.596408
Centre Socioculturel Accoord - Breil Malville;L’Accoord a pour objectif de développer l’action éducative, sociale et culturelle pendant le temps libre à Nantes. L’association propose une offre de services autour de l'animation sociale, le développement culturel et les loisirs socio-éducatifs. Des espaces multimédias sont ouverts pour découvrir, utiliser et être aidé dans la pratique du multimédia. Le centre socioculturel Accoord Breil Malville propose également un accompagnement à l’appropriation des usages numériques pour des projets personnels et professionnels.;- Accéder à Internet- Être initié aux outils numériques- Pratiquer une activité ludique et éducative;- Assistance et conseil sur place- Ateliers : Internet, la bureautique, les logiciels libres, la vidéo et la photo;sur inscription;;pour tous;;payant (adhésion annuelle : de 0 à 15€);ordinateurs équipés d’accès Internet et de logiciels bureautiques, imprimantes, scanner, Wifi;14h00-17h00;14h00-18h00;9h30-12h / 14h00-17h30;14h00-18h00;9h30-12h / 14h00-18h00;14h00-17h00;;;Maison de quartier du Breil – 52 rue du Breil;44100;Nantes;02 40 76 08 54;;cyber.breil@accoord.fr;https://www.accoord.fr/https://mqbreil.wordpress.com/;L54 (arrêt Petit Carcouët);;47.229525,-1.586315
Bibliothèque de la Halvêque;Ouvertes à tous, les bibliothèques municipales sont présentes dans les différents quartiers de la Ville de Nantes. Elles proposent un large catalogue de documents accessibles en ligne ainsi que des ordinateurs pour la consultation d'Internet dont certains disposent également de logiciels de bureautique.;Accéder à Internet;Assistance et conseil sur place;libre;;pour tous;;gratuit;ordinateurs équipés d’accès Internet et de logiciels bureautiques, photocopieur, imprimante.;;13h30-19h00;10h00-12h00 / 13h30-18h00;13h30-18h00;13h30-18h00;10h00-12h00 / 13h30-17h00;;;23 rue Léon Serpollet;44300;Nantes;02 40 41 53 47;;bm-nord@mairie-nantes.fr;https://bm.nantes.fr;Tramway L1 et L95 (arrêt Halvêque) - L77 (arrêt Malraux);;47.255569,-1.521628
