Nom;Descriptif;Type de pratique;Accompagnement;Accès;Usage spécifique;Public;Précisions sur le public;Tarif;Equipements et matériels;Lundi;Mardi;Mercredi;Jeudi;Vendredi;Samedi;Dimanche;Précisions sur les horaires;Adresse;Code postal;Ville;Téléphone 1;Téléphone 2;Mail;Web;Accès transports en commun;Label;Géolocalisation
Maison de l'emploi - Site Malakoff;La Maison de l'emploi de la métropole nantaise propose aux demandeurs d'emploi, aux salariés, aux entreprises et aux créateurs potentiels, l’accès à des cyberbases animées par des professionnels.  Des initiations à l'outil informatique sont organisées régulièrement pour vous aider dans votre recherche d'emploi : manipuler la souris et apprendre le clavier, prendre en main un ordinateur, réaliser son CV avec   un logiciel de traitement de texte, créer et gérer sa boîte e-mail, rechercher un emploi avec Internet...;- Accéder à Internet (pour la recherche d’emploi)- Être initié aux outils numériques;- Assistance et conseil sur place- Atelier d'initiation à l’outil informatique et ateliers liés à la recherche d'emploi.;libre;la recherche d'emploi, de formation et de création d'entreprise;pour tous;particulièrement les demandeurs d'emploi, les salariés et les créateurs d'entreprise;gratuit;ordinateurs avec accès Internet et bureautique, photocopieur, scanner, imprimante;11h00-12h30 / 13h30-16h30;11h00-12h30 / 13h30-16h30;11h00-12h30 / 13h30-16h30;13h30-16h30;11h00-12h30 / 13h30-16h30;;;;5 rue de l'Autriche;44000;Nantes;02 28 44 33 80;;espace.malakoff@me-metropole-nantaise.org;http://www.me-metropole-nantaise.org/;Chronobus C3 (arrêt Ecosse);Label  NetPublic;47.216169,-1.525014
Médiagraph;L’association Médiagraph propose d’initier et de former au numérique tous les publics, même ceux qui s'en sentent les plus éloignés. Médiagraph considère que les outils et usages numériques sont indispensables à la lutte contre les inégalités (accès aux savoirs, à la culture, aux droits, à la citoyenneté, à l’emploi) mais aussi un levier essentiel pour renforcer le partage et la transmission des connaissances, le rapprochement entre les générations et les capacités d’expression de chacun. L'association accompagne aussi toute structure publique ou privée (collectivités, associations, entrepreneurs individuels…).;- Accéder à Internet - Être initié aux outils et usages numériques- Être sensibilisé aux risques d'Internet- Être accompagné dans mes démarches administratives- Être accompagné dans son projet personnel, professionnel, associatif;- Atelier séniors : prise en main, perfectionnement, découverte- Formations professionnelles et associatives (salariés, bénévoles associatifs, porteurs de projets...) -Atelier scolaire, atelier intergénérationnel…- Assistance et conseil sur place;sur inscription;renseignements et inscriptions les lundis matin de 9h00 à 12h30 et vendredis après-midi de 14h00 à 17h00 ou sur rendez-vous;pour tous;;payant (adhésion annuelle : de 31 à 90€) + prix des ateliers;ordinateurs équipés d’accès Internet, de logiciels bureautiques et de logiciel de retouche de photo, scanner, imprimante, Wifi;;;;;;;;Horaires variables en fonction des ateliers;1 rue d'Auvours;44000;Nantes;02 40 12 19 12;;contact@assomediagraph.fr;http://www.assomediagraph.fr/;Tramway L3 (arrêt Viarme Talensac);Label  NetPublic;47.221385,-1.563518
Maison de l'emploi - Site Dervallières;La Maison de l'emploi de la métropole nantaise propose aux demandeurs d'emploi, aux salariés, aux entreprises et aux créateurs potentiels, l’accès à des cyberbases animées par des professionnels.  Des initiations à l'outil informatique sont organisées régulièrement pour vous aider dans votre recherche d'emploi : manipuler la souris et apprendre le clavier, prendre en main un ordinateur, réaliser son CV avec   un logiciel de traitement de texte, créer et gérer sa boîte e-mail, rechercher un emploi avec Internet…;- Accéder à Internet (pour la recherche d’emploi)- Être initié aux outils numériques;- Assistance et conseil sur place- Atelier d'initiation à l’outil informatique et ateliers liés à la recherche d'emploi;libre;la recherche d'emploi, de formation et de création d'entreprise;pour tous;particulièrement les demandeurs d'emploi, les salariés et les créateurs d'entreprise;gratuit;ordinateurs avec accès Internet et bureautique, photocopieurs, scanner, imprimante;11h00-12h30 / 13h30-16h30;11h00-12h30 / 13h30-16h30;11h00-12h30 / 13h30-16h30;13h30-16h30;8h30-12h30 / 13h30-16h30;;;;Pôle Daniel Asseray - 8 rue Henri Matisse;44100;Nantes;02 28 03 58 00;;espace.dervallieres@me-metropole-nantaise.org;http://www.me-metropole-nantaise.org/;Chronobus C3 (arrêt Raoul Dufy) C6 (arrêt St Laurent);Label  NetPublic;47.22335,-1.596814
Toit à Moi;L’association Toit à Moi à pour objectif une réelle insertion des personnes dans la société, autant d’un point de vue économique que d’un point de vue humain. Une équipe de bénévoles s’est constituée pour aider les personnes que l’association loge et accompagne. Dans les cadre de ses mission, Toit à Moi aide également à la recherche de formation et dans la réalisation des démarches administratives, propose la création d’un blog et du soutien informatique.;- Accéder à Internet- Être initié aux outils numériques- Être accompagné dans mes démarches administratives- Être accompagné dans mon projet personnel ou professionnel;- Assistance et conseil sur place- Ateliers autour de la recherche d’emploi;sur inscription;;personnes isolées en situation de précarité;;gratuit;ordinateurs équipés d’accès Internet et de logiciels bureautiques, scanner, photocopieur, imprimante, Wifi;9h00-17h00;9h00-17h00;9h00-17h00;9h00-17h00;9h00-17h00;;;;19 rue Eugène Tessier;44000;Nantes;09 53 05 37 07;;alexandre.casseron@toitamoi.net;http://www.toitamoi.net/;Chronobus C1 (arrêt Bel Air);;47.226047,-1.557974
La Bagagerie - Martyrs Nantais (Association Saint Benoît Labre);L’association Saint Benoît Labre lutte contre l’exclusion des personnes en difficultés sociales et professionnelles et vient en aide aux personnes et familles en précarité. Dans ce cadre, l’association met à disposition des usagers de l’association des espaces informatiques dans ses centres d’hébergement. Ces lieux d’activité informatique permettent de s’initier à l’informatique, d’utiliser Internet, de créer un CV, d’échanger avec ses proches par mail, de se détendre, de se cultiver et de se former à la bureautique.;- Accès libre à Internet- Être initié aux outils informatiques- Être accompagné dans mon projet personnel ou professionnel;Assistance et conseil sur place;Adhérents et résidents à la Bagagerie;;personnes en situation de précarité;;gratuit;ordinateurs équipés d’accès Internet et de logiciels bureautiques,Wifi;8h00-12h00 / 14h00-18h00;8h00-12h00 / 14h00-18h00;8h00-12h00 / 14h00-18h00;8h00-12h00 / 14h00-18h00;8h00-12h00 / 14h00-18h00;;;;17 boulevard des Martyrs Nantais;44200;Nantes;;;;http://asbl44.com/;Tramway L2 L3 (arrêt Wattignies);;47.20296,-1.54568
Studio 11/15;Créé par la Ville de Nantes et animé par l’Accoord, le Studio 11/15 est un espace aux loisirs et à la créativité, qui propose aux adolescents de découvrir des activités artistiques, ludiques, culturelles, sportives et multimédia. L’objectif de ses ateliers est de partager, de donner envie aux adolescents de participer, et de rendre visibles leurs initiatives. Situé au cœur du Quartier de la création, le Studio 11/15 est un lieu de croisement, de rencontres, de créativité et d’échanges.;- Pratiquer une activité ludique et éducative - Être sensibilisé aux risques d'Internet;- Ateliers : éducation aux médias- soirée d’échanges parents – ados;sur inscription;;pour les jeunes de 11 à 15 ans;;payant (adhésion annuelle : de 31 à 90€) + prix des atelier;ordinateurs équipés de logiciels de montage, plateau radio, tablettes;;;;;;;;Horaires variables en fonction des ateliers;7 boulevard Léon Bureau;44200;Nantes;02 44 76 11 07;;studio11-15@accoord.fr;https://www.nantes.fr/studio1115;Chronobus C5 (arrêt Gare de l’Etat );;47.206157,-1.563969
Atelier Partagé du Breil (Association PiNG);L’Atelier Partagé du Breil est un atelier collaboratif où chacun peut venir fabriquer, réparer, créer tous types d’objets. L’atelier est animé par l’association PiNG, acteur impliqué dans l’utilisation des logiciels libres dans une démarche de démocratisation et de pérennité des pratiques autour du numérique.;Pratiquer une activité ludique et éducative;- Assistance et conseil sur place- Ateliers d'entraide réparation- Ateliers d'entraide informatique animé par l'association Naga;libre;sous condition d’adhésion;pour tous;à partir de 18 ans;payant (adhésion annuelle : de 16 à 30€);outillage traditionnel (tournevis / perceuse…), électronique de base (fers à souder, composants…), machines à coudre, imprimante 3D, Wifi;;14h00-20h00;;;;;;;38 rue du Breil;44100;Nantes;02 40 16 86 78;;atelierpartage@pingbase.net;http://www.pingbase.net/atelier-partage-du-breil;L54 (arrêt Petit Carcouët);;47.228811,-1.58443
Médiathèque Luce Courville;Ouvertes à tous, les médiathèques municipales sont présentes dans les différents quartiers de la Ville de Nantes. Elles proposent un large catalogue de documents (livres, CD, DVD, BD, …) accessibles en ligne ainsi que de ordinateurs pour la consultation d'Internet et/ou des logiciels de bureautique.;- Accéder à Internet;- Assistance et conseil sur place- Ateliers : initiation à l'informatique, accompagnement numérique (découverte du clavier et de la souris, créer et gérer sa boite mail, …), aide aux démarches sur Internet;libre;;pour tous;;gratuit;ordinateurs équipés d’accès Internet et de logiciels bureautiques, photocopieur, imprimante, Wifi;;13h30-18h00;10h00-18h00;13h30-18h00;13h30-19h00;10h00-17h00;;;1 rue Eugène Thomas;44300;Nantes;02 40 41 53 50;;bm-nord@mairie-nantes.fr;https://bm.nantes.fr/home.html;Tramway L2, Chronobus C2 et L96 (arrêt Chêne des Anglais);;47.26168,-1.574329
Association Culturelle Musulmane Nantes Nord (ACMNN);L'Association Culturelle Musulmane Nantes Nord (ACMNN) favorise les rencontres, les échanges, l’entraide et la solidarité dans les quartiers de la ville de Nantes. Sur le numérique, ses activités s’articulent autour de l’accompagnement des usagers, notamment dans leurs démarches administratives.;- Accéder à Internet- Être initié aux outils numériques- Être accompagné dans mes démarches administratives;- Ateliers  : création-gestion de boîte email, apprendre à taper du texte, création-gestion des dossiers et fichiers- Accompagnement dans les démarches administratives;sur inscription;;pour tous;;gratuit;ordinateurs équipés d’accès Internet et de logiciels bureautiques, scanner, photocopieur, imprimante, Wifi;16h00–17h00;10h30–12h00;;10h30-12h0016h00-17h00;18h30-20h;10h30–12h00;;;3 rue Eugène Thomas;44300;Nantes;02 40 16 00 98;06 64 09 81 46;acmnn@wanadoo.fr;http://www.acmnn.fr;"Tramway L2 ; Chronobus C2 et L96 (arrêt Chêne des Anglais)";;47.263017,-1.57286
Maison de l'emploi - Site Nantes Est;La Maison de l'emploi de la métropole nantaise propose aux demandeurs d'emploi, aux salariés, aux entreprises et aux créateurs potentiels, l’accès à des cyberbases animées par des professionnels.  Des initiations à l'outil informatique sont organisées régulièrement pour vous aider dans votre recherche d'emploi : manipuler la souris et apprendre le clavier, prendre en main un ordinateur, réaliser son CV avec   un logiciel de traitement de texte, créer et gérer sa boîte e-mail, rechercher un emploi avec Internet…;- Accéder à Internet (pour la recherche d’emploi)- Être initié aux outils numériques;- Assistance et conseil sur place- Atelier d'initiation à l’outil informatique et ateliers liés à la recherche d'emploi.;libre;la recherche d'emploi, de formation et de création d'entreprise;pour tous;particulièrement les demandeurs d'emploi, les salariés et les créateurs d'entreprise;gratuit;ordinateurs avec accès Internet et bureautique, photocopieur, scanner, imprimante;10h30 à 12h30 / 13h30 à 16h30;10h30 à 12h30 / 13h30 à 16h30;8h30 à 12h30 / 13h30 à 16h30;13h30-16h30;10h30 à 12h30 / 13h30 à 16h30;;;;9 rue Augustin Fresnel;44300;Nantes;02 40 08 97 20;;espace.nantes.est@me-metropole-nantaise.org;http://www.me-metropole-nantaise.org/;Chronobus C1 (arrêt Chocolaterie) / L11 (arrêt Ménétrier);Label  NetPublic;47.24124,-1.523846
Médiathèque Lisa Bresner;Ouvertes à tous, les médiathèques municipales sont présentes dans les différents quartiers de la Ville de Nantes. Elles proposent un large catalogue de documents (livres, CD, DVD, BD, …) accessibles en ligne ainsi que de ordinateurs pour la consultation d'Internet et/ou des logiciels de bureautique. Certaines médiathèques proposent également des ateliers d’initiation au numérique.;- Accéder à Internet - Être initié aux outils numériques;- Assistance et conseil sur place- Ateliers : initiation à l'informatique et accompagnement numérique (découverte du clavier et de la souris, créer et gérer sa boite mail, …);libre;;pour tous;;gratuit;ordinateurs équipés d’accès Internet et de logiciels bureautiques, photocopieur, imprimante, Wifi;;13h30-18h00;10h00-18h00;13h30-18h00;13h30-19h00;10h00-17h00;;;23 boulevard Émile Romanet;44100;Nantes;02 40 41 54 00;;bm-ouest@mairie-nantes.fr;https://bm.nantes.fr/home.html;Tramway L1 (arrêt Jamet) / L1 (arrêt Croix Bonneau);;47.209929,-1.60304
Plateforme C;Plateforme C est un atelier collaboratif de fabrication numérique et de prototypage rapide (fabab) animé par l’association PiNG. Dans un espace de 300m2, Plateforme C rassemble tous les outils que l’on trouve dans un atelier de bricolage traditionnel -établis électroniques, mécaniques, et bois- ainsi que des des machines à commande numérique, pilotées par ordinateur (imprimantes 3D, découpe vinyle, découpe laser, fraiseuse numérique, etc.);- Pratiquer une activité ludique et éducative- Être accompagné dans mon projet personnel ou professionnel;- Assistance et conseil sur place- Ateliers  d'initiation pour chaque machine à commande numérique (de 1h30 à 3h)- Fab Lab (atelier de création)- Espace ressources aux publications sur la culture numérique;libre;sous condition d’adhésion – Découverte gratuite le mardi à 19h;pour tous;à partir de 18 ans;payant (adhésion annuelle : de 31 à 90€ pour l’openatelier du jeudi / adhésion annuelle + forfait tarifaire pour les ateliers projets organisés les autres jours de la semaine);Machines à commande numériques (imprimantes 3D, découpe laser, fraiseuse numériques, routeur CNC, découpe vinyle), établis, outils électroniques et textiles, Wifi - Espace ressource aux publications sur la culture numérique;;14h00-21h00;14h00-21h00;14h00-21h00;10h00-18h00;;;;Hangar 30 – quai des Antilles;44200;Nantes;02 51 84 13 57;;contact@plateforme-c.org;http://www.plateforme-c.org/;Tramway L1 (arrêt Chantiers Navals) / Chronobus C5 (arrêt quai des Antilles);;47.203369,-1.57187
Centre Socioculturel Accoord - Bourderies;L’Accoord a pour objectif de développer l’action éducative, sociale et culturelle pendant le temps libre à Nantes. L’association propose une offre de services autour de l'animation sociale, le développement culturel et les loisirs socio-éducatifs. Des espaces multimédias sont ouverts pour découvrir, utiliser et être aidé dans la pratique du multimédia. Le centre socioculturel Accoord Bourderies propose également un accompagnement à l’appropriation des usages numériques pour des projets personnels et professionnels.;- Accéder à Internet- Être initié aux outils numériques- Être accompagné dans mes démarches administratives- Pratiquer une activité ludique et éducative;- Assistance et conseil sur place- Ateliers : la bureautique, le traitement d'images, la protection de son ordinateur et ses données, le stockage de données en ligne, l’installation logiciels;sur inscription;;pour tous;;payant (adhésion annuelle : de 0 à 15€);ordinateurs équipés d’accès Internet et de logiciels bureautiques, imprimante, scanner;;16h15-18h00;;16h15-18h00;;;;;2A rue de Saint Brévin;44100;Nantes;02 40 46 41 46;;bourderies@accoord.fr;https://www.accoord.fr/http://bourderies.blogspot.fr/;L11 (arrêt Bourderies);;47.206682,-1.596419
Médiathèque Jacques Demy;Ouvertes à tous, les médiathèques municipales sont présentes dans les différents quartiers de la Ville de Nantes. Elles proposent un large catalogue de documents (livres, revues, CD, DVD, BD, …) accessibles en ligne ainsi que des ordinateurs pour la consultation d'Internet et/ou l'utilisation des logiciels de bureautique. Certaines médiathèques proposent également des ateliers d’initiation au numérique.;- Accéder à Internet - Être initié aux outils numériques- Pratiquer une activité ludique et éducative;- Assistance et conseil sur place- Ateliers de découverte des ressources numériques : My Cow (apprentissage de l’anglais), InaTHEQUE (accès aux archives TV, radio, pub et web médias conservées par l'ina), logiciels d’autoformation (bureautique, code de la route, langues, soutien scolaire, solfège... );libre;;pour tous;;gratuit;ordinateurs équipés d’accès Internet et de logiciels bureautiques, postes de consultation spécifiques à l'Ina photocopieurs, imprimante, Wifi;12h00-19h00;12h00-19h00;10h00-19h00;12h00-19h00;12h00-19h00;10h00-18h00;;;24 quai de la Fosse;44000;Nantes;02 40 41 95 95;;bm-centre@mairie-nantes.fr;https://bm.nantes.fr/home.html;Tramway L1 (arrêt Médiathèque);;47.21096,-1.561802
Alis44;"L’association ALIS 44 récupère des ordinateurs, les reconditionne sous linux Xubuntu (Xalis) et logiciels libres, puis les redistribue aux personnes à faibles ressources et aux associations. Dans sa démarche de lutte contre l’exclusion en favorisant l’accès aux technologies, l’association propose également des ateliers  ""Prise en Main""  qui ont pour but de vous faire accéder rapidement aux bases informatiques : manipuler l’ordinateur, les fichiers et le système d’exploitation Linux, utiliser Internet, retoucher des photos sont autant de thèmes abordés.";- Accéder à Internet- Être accompagné dans mes démarches administratives - Être initié aux outils informatiques- Pratiquer une activité ludique et éducative;"- Assistance et conseil sur place - Ateliers : Prise en main d'un ordinateur (clavier, souris) ; gérer les fichiers ; Navigation Internet ; Bureautique (Libre Office) ; Gérer Linux ; Initiation aux réseaux et adressages IP ; Musique assistée par ordinateur ; Dessin assisté par ordinateur ; Montage vidéo ; Rajeunir son ordinateur ; alphabétisation numérique ; soutien aux e-démarches.";sur inscription;;pour tous;;payant (adhésion annuelle : de 31 à 90€) + prix des ateliers;ordinateurs équipés d’accès Internet et de logiciels bureautiques, Wifi;9h00-12h00 / 14h00-18h00;9h00-12h00 / 14h00-18h00;9h00-12h00 / 14h00-18h00;10h00-12h00 / 14h00-18h00;9h00-12h00 / 14h00-18h00;;;;60 rue de la Bottière;44300;Nantes;09 51 11 21 45;;alis-asso@alis44.org;http://alis44.org/;L11 (arrêt Lippman);;47.23915,-1.519944
Stereolux;Les ateliers menés par l'Action Culturelle de Stéréolux sont une expérience forte et ludique, pour petits et grands, où chacun se fait acteur et créateur : une récréation digitale et numérique, propice à la découverte et aux échanges. Les différentes actions sont destinées à un large panel de publics, de la petite enfance aux seniors,  avec la volonté de s'adresser au plus grand nombre – quels que soit les moyens financiers, les disponibilités et les aptitudes de chacun –, dans le souci constant du vivre ensemble et du décloisonnement générationnel. Les ateliers et autres activités développés promeuvent des pratiques créatives et diversifiées autour du multimédia et de nouvelles disciplines, parfois méconnues.;- Être initié aux outils numériques- Pratiquer une activité ludique et éducative;- Ateliers : Robotique, light painting, Autoportrait 3D- Thé numérique pour les séniors;sur inscription;;pour tous;;atelier payant (de 31 à 90€);Ordinateurs équipés d’accès Internet et de logiciels (montage vidéo, code créatif – processing, montage son) Wifi;;;;;;;;Horaires variables en fonction des ateliers;4 boulevard Léon Bureau;44200;Nantes;02 51 80 60 80;;melanie.legrand@stereolux.org;https://www.stereolux.org/;Tramway L1 (arrêt Chantiers Navals) / Chronobus C5 (arrêt Prairie au Duc) /  bus de nuit : Circuit B: (arrêt Prairie au Duc);;47.206011,-1.563948
LAB'J - Efferv&sciences;L’Accoord a pour objectif de développer l’action éducative, sociale et culturelle pendant le temps libre à Nantes. L’association propose une offre de services autour de l'animation sociale, le développement culturel et les loisirs socio-éducatifs. Sur le numérique, le centre socioculturel  Accoord Lab'J axe son offre sur la programmation, les activités éducatives et ludiques, l’impression 3D et la robotique.;Pratiquer une activité ludique et éducative;- Assistance et conseil sur place- Ateliers  : programmation et robotique;sur inscription;;pour les jeunes de 9 à 15 ans;;payant (adhésion annuelle : de 0 à 15€);ordinateurs équipés d’accès Internet et de logiciels bureautiques, scanner, photocopieur, imprimantes 3D, robots Thymio et Mbot, kit Makey Makey, modules Arduino, Wifi;;;14h00-17h00;;;;;;Espace animation Beaulieu – 2 rue Marc Vaubourgoin;44200;Nantes;02 51 72 39 82;;efferv-sciences@accoord.fr;https://www.facebook.com/effervsciences/?fref=ts;Chronobus C5 et L26  (arrêt Pompidou);;47.208167,-1.527055
L’EclectiC Leo Lagrange;L'EclectiC Léo Lagrange est une pépinière d'initiatives jeunesse (16-25 ans) situé dans le quartier Nord de Nantes (maison de quartier La Mano). C’est un lieu d’accueil, d’information, d’orientation et d’accompagnement de toutes les initiatives et projets de jeunes (individuels ou collectifs), dans les domaines de la culture, du sport, des arts, de l’insertion ou encore de la mobilité (locale, internationale). La pépinière est également un lieu d’animation notamment à travers ces « RDV de L’EclectiC » (cafés citoyens, sorties culturelles…) autant de moment d’échanges, de débats, de rencontres et de découvertes dans une ambiance conviviale.;- Accéder à Internet- Être accompagné dans mes démarches administratives- Pratiquer une activité ludique et éducative- Être  accompagné dans mon projet personnel ou professionnel;Assistance et conseil sur place;sur inscription;;pour les jeunes de 16 à 25 ans;;gratuit;ordinateurs équipés d’accès Internet, de logiciels bureautiques, de logiciels de graphisme, montage vidéo et de retouches photos, Wifi;;10h00-18h00;10h00-18h00;10h00-18h00;10h00-18h00;10h00-18h00;;;Maison de quartier La Mano (2ème étage) – 3 rue Eugène Thomas;44300;Nantes;02 40 40 91 18;;contact@eclectic-leolagrange.org;https://www.facebook.com/leclectic.leolagrange/;Tramway L2 (arrêt Chêne des Anglais);;47.263017,-1.57286
APO-33;Apo33 est un laboratoire artistique, technologique et théorique transdisciplinaire qui développe des projets collectifs alliant recherche, expérimentation et intervention dans l’espace social. S’inscrivant dans la continuité des dynamiques ouvertes par le mouvement des logiciels libres, Apo33 se construit comme un espace modulaire initiant des projets et processus de création collaboratifs et représente les formes émergentes de création et d’expérimentation artistiques et culturelles liées aux arts sonores et multimédia.;Pratiquer une activité ludique et éducative;- Assistance et conseil sur place- Ateliers : Musique électronique et création numérique sonore;sur inscription;;pour tous;;atelier payant (de 31 à 90€);Ordinateurs : systéme informatique pour la création numérique – Apo33, imprimante 3D, caméra, enregistreur sonore, système amplification, vidéoprojecteur, station montage électronique, Fablab, bricolage, arduino, raspberry pi, Wifi;10h00-17h00;10h00-17h00;10h00-17h00;10h00-17h00;10h00-17h00;;;;17 rue Paul Bellamy;44000;Nantes;02 51 89 47 16;;orga@apo33.org;http://apo33.org/index.php/fr/;Tramway L1 (arrêt 50 otages) / Chronobus C2 – L12 et L23 (arrêt Talensac);;47.221887,-1.556405
