ORPAN;Lieu d’accueil et d’information, l’ORPAN, l’association des seniors nantais est un acteur d’innovation et de structuration d’offres autour des besoins et des attentes des retraités et des personnes âgées. Dans le cadre de ses missions, l’association propose des ateliers d’initiation à l'informatique, à l’utilisation d’outils numériques et à la manipulation au matériel pour les usages du quotidien.;- Être initié aux outils numériques;- Assistance et conseil sur place à partir des applications numériques développées par l’association (inscription et paiement en ligne, création d’un compte utilisateur, création d’une page Facebook...)- Ateliers : initiation à l'informatique et à l’utilisation d’outils numériques, sensibilisation-manipulation au matériel (tablette, smartphone) dans les usages du quotidien;sur inscription;;seniors et retraités;;assistance et conseil gratuits - atelier payant;il est nécessaire de venir avec son propre équipement (smartphone, tablette, ordinateurs portables, etc.). Wifi sur place.;;;;;;;;Horaires variables en fonction des ateliers;6 place du Port Communeau;44000;Nantes;02 40 99 26 00;;contact@orpan.fr;https://www.orpan.fr/;Tram L1, Chronobus C2, L12 et L23  (arrêt 50 otages);;47.219968,-1.554694
La Bagagerie - Fouré (Association Saint Benoît Labre);L’association Saint Benoît Labre lutte contre l’exclusion des personnes en difficultés sociales et professionnelles et vient en aide aux personnes et familles en précarité. Dans ce cadre, l’association met à disposition des usagers de l’association des espaces informatiques dans ses centres d’hébergement. Ces lieux d’activité informatique permettent de s’initier à l’informatique, d’utiliser Internet, de créer un CV, d’échanger avec ses proches par mail, de se détendre, de se cultiver et de se former à la bureautique.;Accéder à Internet- Être initié aux outils informatiques- Être accompagné dans mon projet personnel ou professionnel;;Adhérents  à la Bagagerie;;personnes en situation de précarité;;gratuit;ordinateurs équipés d’accès Internet et de logiciels bureautiques,;14h00-16h00;14h00-16h00;14h00-16h00;14h00-16h00;14h00-16h00;;;;14 rue Fouré;44000;Nantes;;;;http://asbl44.com/;Busway L4 (arrêt Cité Internationale des Congrès);;47.213387,-1.546493
Centre Socioculturel Accoord - Bellevue Jamet - SPIJ;L’Accoord a pour objectif de développer l’action éducative, sociale et culturelle pendant le temps libre à Nantes. L’association propose une offre de services autour de l'animation sociale, le développement culturel et les loisirs socio-éducatifs.  Des espaces multimédias sont ouverts pour découvrir, utiliser et être aidé dans la pratique du multimédia. Des formations et des ateliers y sont également proposés régulièrement.;- Accéder à Internet- Être accompagné dans mon projet personnel ou professionnel;- Assistance et conseil sur place- Accompagnement à la demande pour la recherche d'emploi (CV, lettre de motivation, …);sur inscription;;pour les jeunes de 16 à 25 ans;;payant (adhésion annuelle : de 0 à 15€);Équipement & matériel : ordinateurs équipés d’accès Internet et de logiciels bureautiques, imprimante, scanner;14h00-18h00;16h00-19h00;14h00-18h00;16h00-19h00;16h00-19h00;;;;25 rue du Jamet;44100;Nantes;02 40 46 83 35;;bellevue.spij@accoord.fr;https://www.accoord.fr/;Tramway L1 (arrêt Jamet);;47.207487,-1.605184
Regart's;Le but de l’association Regart's est d’offrir à tous les publics un appui pour leur vie quotidienne, leur estime de soi et leurs démarches de loisirs pour construire une société plus digne, plus juste et plus solidaire. Dans le cadre de ses missions, l’association propose des ateliers d’initiation à l'informatique pour les usages du quotidien.;- Être initié aux outils informatiques;- Assistance et conseil sur place- Ateliers : initiation à l'outil informatique;sur inscription;;pour tous;;payant (adhésion annuelle : de 31 à 90€) + prix des ateliers;ordinateurs équipés d’accès Internet et de logiciels bureautiques;;;;;9h30-11h00;;;;5 rue du Gers;44100;Nantes;02 40 85 63 27;;a.associationregarts@sfr.fr;http://www.associationregartsnantes.org/;Tramway L1 (arrêt Lauriers);;47.205029,-1.604768
Bibliothèque Chantenay;Ouvertes à tous, les bibliothèques municipales sont présentes dans les différents quartiers de la Ville de Nantes. Elles proposent un large catalogue de documents accessibles en ligne ainsi que des ordinateurs pour la consultation d'Internet dont certains disposent également de logiciels de bureautique.;Accéder à Internet;Assistance et conseil sur place;libre;;pour tous;;gratuit;ordinateurs équipés d’accès Internet et de logiciels bureautiques;;13h30-18h00;10h00-12h00 / 13h30-18h00;13h30-18h00;13h30-19h00;10h00-12h00 / 13h30-17h00;;;8 rue de la Constitution;44100;Nantes;02 40 46 26 96;;bm-ouest@mairie-nantes.fr;https://bm.nantes.fr;Tramway L1 (arrêt Égalité) - L10 (arrêt Mairie de Chantenay) - L11 (arrêt Marseillaise);;47.206046,-1.589223
Maison de l'emploi - Site Nantes Nord;La Maison de l'emploi de la métropole nantaise propose aux demandeurs d'emploi, aux salariés, aux entreprises et aux créateurs potentiels, l’accès à des cyberbases animées par des professionnels.  Des initiations à l'outil informatique sont organisées régulièrement pour vous aider dans votre recherche d'emploi : manipuler la souris et apprendre le clavier, prendre en main un ordinateur, réaliser son CV avec   un logiciel de traitement de texte, créer et gérer sa boîte e-mail, rechercher un emploi avec Internet...;- Accéder à Internet (pour la recherche d’emploi)- Être initié aux outils numériques;- Assistance et conseil sur place- Atelier d'initiation à l’outil informatique et ateliers liés à la recherche d'emploi.;libre;la recherche d'emploi, de formation et de création d'entreprise;pour tous;particulièrement les demandeurs d'emploi, les salariés et les créateurs d'entreprise;gratuit;ordinateurs avec accès Internet et bureautique, photocopieur, scanner, imprimante;;;;;;;;Horaires variables en fonction des ateliers;81 rue des Renards;44300;Nantes;02 40 59 98 43;;espace.nantes.nord@me-metropole-nantaise.org;http://www.me-metropole-nantaise.org/;Tramway L2 et L96 (arrêt Santos Dumont);Label  NetPublic;47.254779,-1.565662
Les Petits Débrouillards;Pour rendre visibles des concepts ou des notions parfois abstraits à tous les publics, et plus particulièrement des enfants et des jeunes, le mouvement des Petits Débrouillards favorise la découverte de toutes les sciences et technologies, à partir de l’expérimentation ludique et concrète. Avec pour objectif de donner à chacun et chacune accès aux technologies numériques au service de la citoyenneté et du savoir partagé.;Pratiquer une activité ludique et éducative;atelier à caractère scientifique;;;pour les enfants de 6 à 12 ans;;payant (adhésion annuelle : de 31 à 90€);;;;;;;;;Horaires et lieux variables en fonction des ateliers;19 rue Jean Marc Nattier;44100;Nantes;02 40 46 59 54;;j.hegic@lespetitsdebrouillards.org;https://www.lespetitsdebrouillards-paysdelaloire.org/;Chronobus C3 (arrêt Delacroix);;47.225014,-1.591085
Maison de l'emploi - Site Nantes Centre;La Maison de l'emploi de la métropole nantaise propose aux demandeurs d'emploi, aux salariés, aux entreprises et aux créateurs potentiels, l’accès à des cyberbases animées par des professionnels.  Des initiations à l'outil informatique sont organisées régulièrement pour vous aider dans votre recherche d'emploi : manipuler la souris et apprendre le clavier, prendre en main un ordinateur, réaliser son CV avec   un logiciel de traitement de texte, créer et gérer sa boîte e-mail, rechercher un emploi avec Internet…;- Accéder à Internet (pour la recherche d’emploi)- Être initié aux outils numériques;- Assistance et conseil sur place- Atelier d'initiation à l’outil informatique et ateliers liés à la recherche d'emploi.;libre;la recherche d'emploi, de formation et de création d'entreprise;pour tous;particulièrement les demandeurs d'emploi, les salariés et les créateurs d'entreprise;gratuit;ordinateurs avec accès Internet et bureautique, photocopieur, scanner, imprimante;8h30-12h30 / 15h30-16h30;8h30-12h30;8h30-12h30 / 15h30-16h30;13h30-16h30;8h30-12h30 / 15h30-16h30;;;;5 rue de l'Ile Mabon;44200;Nantes;02 40 69 36 36;;espace.centre@me-metropole-nantaise.org;http://www.me-metropole-nantaise.org/;Chronobus C5 (arrêt Gare de l'Etat) / L26 (arrêt République);Label  NetPublic;47.207532,-1.559309
Bibliothèque Breil Malville;Ouvertes à tous, les bibliothèques municipales sont présentes dans les différents quartiers de la Ville de Nantes. Elles proposent un large catalogue de documents accessibles en ligne ainsi que des ordinateurs pour la consultation d'Internet dont certains disposent également de logiciels de bureautique.;Accéder à Internet;Assistance et conseil sur place;libre;;pour tous;;gratuit;ordinateurs équipés d’accès Internet et de logiciels bureautiques, photocopieur.;;13h30-19h00;10h00-12h00 / 13h30-18h00;13H30-18h00;13h30-18h00;10h00-12h00 / 13h30-17h00;;;37 bis avenue des Plantes;44100;Nantes;02 40 76 06 56;;bm-ouest@mairie-nantes.fr;https://bm.nantes.fr;Tramway L3 (arrêt Longchamp);;47.232606,-1.587051
Maison de l'emploi - Site Bellevue;La Maison de l'emploi de la métropole nantaise propose aux demandeurs d'emploi, aux salariés, aux entreprises et aux créateurs potentiels, l’accès à des cyberbases animées par des professionnels.  Des initiations à l'outil informatique sont organisées régulièrement pour vous aider dans votre recherche d'emploi : manipuler la souris et apprendre le clavier, prendre en main un ordinateur, réaliser son CV avec   un logiciel de traitement de texte, créer et gérer sa boîte e-mail, rechercher un emploi avec Internet…;- Accéder à Internet (pour la recherche d’emploi)- Être initié aux outils numériques;- Assistance et conseil sur place- Atelier d'initiation à l’outil informatique et ateliers liés à la recherche d'emploi.;libre;;pour tous;particulièrement les demandeurs d'emploi, les salariés et les créateurs d'entreprise;gratuit;ordinateurs équipés d’accès Internet et de logiciels bureautiques, photocopieur, scanner, imprimante, appareil photo;8h30-12h30;11h00-12h30 / 13h30-16h30;11h00-12h30 / 13h30-16h30;13h30-16h30;8h30-12h30 / 13h30-16h30;;;;46 boulevard Jean Moulin;44100;Nantes;02 51 80 41 51;;espace.bellevue@me-metropole-nantaise.org;http://www.me-metropole-nantaise.org/;Tramway L1 et L11 (arrêt Jean Moulin);Label  NetPublic;47.205752,-1.601586
AGENCE CONSEIL FORMATION AFPA;L’Agence Conseil Formation AFPA est un accueil de proximité pour vous conseiller dans votre orientation et projet professionnel, pour vous aider à construire un parcours de formation et à identifier les solutions et les financements possibles. Un appui ponctuel à la recherche d’emploi est également possible (rédaction de CV, lettre de motivation, s’entraîner à un entretien). Cette agence est aussi un relai vers le centre de formation pour adultes situé à St Herblain où nous formons dans tous secteurs d’activités confondus : industrie, bâtiment et tertiaire.;-  Accéder à Internet-  Être accompagné dans mon projet personnel ou professionnel,;- Assistance et conseil sur place : oui - Atelier : oui  – les financements de formation, l’orientation professionnelle (offre de service en évolution);libre sur les horaires de permanences;possibilité également sur inscription en envoyant un e-mail ou en appelant;être âgé de 18 ans minimum;;gratuit;1 PC sur place disponible;;9h00-12h30 / 13h30-17h00;;;9h00-12h30;;;ouvert occasionnellement le vendredi après-midi, prendre contact au préalable;60, boulevard Winston Churchill;44100;Nantes;02 51 36 50 06;;bellevueconseilformation@afpa.fr;;Arrêt Mendès France Bellevue (tramway ligne 1 et bus n° 23, 40, 59, 81, 91).;;47.209193,-1.610732
Restaurant Pierre Landais;Le restaurant social Pierre Landais est un établissement municipal situé au cœur de l'île de Nantes Il permet de déjeuner, parler à un travailleur social, renouer du lien, trouver des ressources ou simplement se poser, participer aux activités et aux animations. Dans ce cadre, l’organisme propose des ateliers d’initiation à l'informatique et un accompagnement pour effectuer ses démarches administratives en ligne.;- Accéder à Internet- Être initié aux outils numériques- Être accompagné dans mes démarches administratives;- Assistance et conseil sur place- Ateliers : Initiation aux outils informatiques, accompagnement dans ses démarches administratifs;libre;;personnes isolées en situation de précarité;;gratuit;ordinateurs équipés d’accès Internet et de logiciels bureautiques, Wifi;12h00-17h00;12h00-17h00;12h00-17h00;12h00-17h00;12h00-17h00;12h00-17h00;;;16 rue Pierre Landais;44200;Nantes;02 40 47 12 61;;;https://www.nantes.fr/restaurant-pierre-landais;Chronobus C5 (arrêt Gare de l’État);;47.205498,-1.559233
Jeunesse Nantaise en Action;Accompagner, informer, orienter, soutenir les jeunes avec des parcours variés : étudiants, salariés, sans emplois de 15-30 ans dans leurs parcours citoyen aussi bien individuel que collectif.L'association assure le suivi de jeunes éloignés des structures institutionnelles et les accompagne.Nous informons, orientons les jeunes vers les partenaires adéquats au vu de leur recherches  insertion, mobilité, accès aux droits ...;- Accéder à Internet- Être accompagné dans mes démarches administratives- Être accompagné dans son projet personnel ou professionnel;Assistance et conseil sur place;libre;;pour les jeunes;de 15 à 30 ans;gratuit;ordinateurs équipés d’accès Internet et de logiciels bureautiques, photocopieur;18h00-22h00;;18h00-22h00;;18h00-22h00;;;;Maison des habitants et du citoyen - 1 place des Lauriers;44100;Nantes;06 62 39 71 91;;jeunesse.nantaise.en.action@outlook.fr;https://www.facebook.com/pages/JNA-Jeunesse-Nantaise-en-Action/509654235882982?pnref=lhc;Tramway L1 (arrêt Lauriers);;47.204709,-1.605251
CPAM Nantes Centre;La Caisse Primaire d’Assurance Maladie a aménagé des espaces libre-service dans ses points d'accueil pour permettre d'effectuer soi-même ses démarches les plus courantes. Animés par les agents d'accueil, ces espaces offrent la possibilité de mettre à jour sa carte Vitale, commander une Carte Européenne d'Assurance Maladie, imprimer ses attestations de droits ou de paiement d'indemnités journalières en utilisant les outils en libre-accès (borne multi-services ou ordinateur avec accès internet) reliés à une imprimante. Pour les dossiers complexes nécessitant une étude approfondie ainsi que pour les dossiers CMU ressources, un rendez-vous est proposé.;- Accéder à Internet- Être accompagné dans mes démarches administratives;Assistance et conseil sur place;libre;;pour tous;;gratuit;Borne multi-services et ordinateur en libre-service avec accès Internet aux sites ameli.fr, caf.fr, pole-emploi.fr et carsat.fr, imprimante;8h30-12h15 / 13h30-17h00;8h30-12h15 / 13h30-17h00;8h30-12h15 / 13h30-17h00;8h30-12h15 / 13h30-17h00;8h30-12h15 / 13h30-17h00;;;;1 rue du Président Édouard Herriot;44000;Nantes;3646.0;;;http://www.ameli.fr/;Tramway L1, Chronobus C1, C2, C6 (arrêt place du Cirque) / L3 (arrêt Bretagne);;47.218577,-1.560369
Informatique Club Nantais (ICN);"Ouvert à toutes et à tous dans un esprit de partage et de convivialité pour promouvoir les possibilités d'utilisation, d'application, de développement, autour des micro-ordinateurs ;de créer un lien permanent entre tous les utilisateurs.";- Être initié aux outils informatiques - Pratiquer une activité ludique et éducative;- Assistance et conseil sur place- Dépannage- Ateliers : vidéo -photo (tous types de matériels), découverte de l’informatique et d’Internet, classement et gestion de documents, évolution des systèmes informatiques, soutien collectif et/ou individuel.;libre;sous condition d’adhésion;pour tous;;payant (adhésion annuelle : de 31 à 90€);ordinateurs équipés d’accès Internet et de logiciels bureautiques, imprimante, scanners pour archivages de vos diapos, films Super 8, Wifi;;;9h00-12h00 (atelier photo-vidéo) / 20h30-22h30;;;;;;Pôle associatif Les Renards - 2 rue des Renards;44300;Nantes;;;icn.44@laposte.net;http://icn44.blog.free.fr/;Tramway L2  (arrêts Bourgeonnière et Boissière)  / L86 (arrêt Bourgeonnière), L96 (arrêt Boissière);;47.253586,-1.561721
Centre Régional Information Jeunesse des Pays de la Loire (CRIJ);Le Centre Régional Information Jeunesse des Pays de la Loire (CRIJ) est un lieu d’accueil à destination des jeunes, jusqu’à 32 ans. Il propose d’informer et d’accompagner sur différentes thématiques afin de permettre à chacun de trouver de l’aide dans ses projets personnels ou professionnels et met à disposition des ordinateurs et 1 tablette dédiés aux recherches d’information, à la réalisation de CV et lettre de motivation.;- Accéder à Internet- Être accompagné dans mon projet personnel ou professionnel;Assistance et conseil sur place;sur inscription;;pour les jeunes jusqu’à 32 ans;;gratuit;ordinateurs équipés d’accès Internet et de logiciels bureautiques, tablettes, imprimantes, Wifi;;14h00-17h00;14h00-17h00;;14h00-17h00;;;;37 rue Saint Léonard;44000;Nantes;02 51 72 94 50;;crij@infos-jeunes.fr;http://www.infos-jeunes.fr/https://www.facebook.com/infosjeunes;Tramway L2 et Chronobus C2 (arrêts 50 otages ou Place du Cirque), Chronobus C6 et C1 (arrêt Hôtel de Ville), L12 et L23 (arrêt 50 Otages);;47.218555,-1.555295
